<?xml version="1.0" encoding="UTF-8"?>
<!DOCTYPE entities SYSTEM "../../../dtds/entities.dtd">
<entities>
   <entity id="http-client-connection-manager" type="connection-manager"
      logic-type="http">
      <property name="dataSourceDefinition">
         <value>
            <entity id="http-client" type="datasource-definition">
               <property name="datasourceType" value="HTTP"></property>
               <property name="configData">
   <value>
      <entity type="config-data">
                     <property name="userInputParams">
            <value>
               <map>
                                      <entry key="USER_AGENT">
   <value>
      <entity type="user-input-parameter">
         <property name="name" value="USER_AGENT"></property>
                  <property name="value" value="Mozilla/5.0 (X11; U; Linux i686; pl-PL; rv:1.9.0.2) Gecko/20121223 Ubuntu/9.25 (jaunty) Firefox/3.8"></property>
                           <property name="type" value="String"></property>
                           <property name="inputType" value="UNKNOWN_VALUE"></property>
                        </entity>
   </value>
</entry>                                      <entry key="MAX_TOTAL_CONNECTIONS">
   <value>
      <entity type="user-input-parameter">
         <property name="name" value="MAX_TOTAL_CONNECTIONS"></property>
                  <property name="value" value="50"></property>
                           <property name="type" value="Integer"></property>
                           <property name="inputType" value="UNKNOWN_VALUE"></property>
                        </entity>
   </value>
</entry>                                      <entry key="CONNECTION_TIMEOUT">
   <value>
      <entity type="user-input-parameter">
         <property name="name" value="CONNECTION_TIMEOUT"></property>
                  <property name="value" value="15000"></property>
                           <property name="type" value="Integer"></property>
                           <property name="inputType" value="UNKNOWN_VALUE"></property>
                        </entity>
   </value>
</entry>                                </map>
            </value>
         </property>
               
                     
                  </entity>
   </value>
</property>            </entity>
         </value>
      </property>
   </entity>
</entities>