<?xml version="1.0" encoding="UTF-8"?>
<!DOCTYPE entities SYSTEM "../../dtds/entities.dtd">
<entities>
   <entity id="test-email-sender" type="workflow-definition"
      logic-type="dynamic-wrapper">
      <entity type="description">
         <value>$workflowDefinition.getDescription()</value>
      </entity>
      <entity logic-type="config">
         <entity type="definition-params" logic-type="static-parameters">
            <value>
               <map>
                  												<entry key="localParameters">
							<value>
								<list>
																	</list>
							</value>
						</entry>
												<entry key="executionEntity">
							<value>
																<entity type="workflow" logic-type="dynamic-wrapper">
   <entity logic-type="config">
      <entity logic-type="executor">
         <entity-ref ref-id="workFlow" />
      </entity>
<!--      <entity logic-type="original-input-name">-->
<!--         <value>inputContext</value>-->
<!--      </entity>-->
      <entity type="workflow-params" logic-type="static-parameters">
         <value>
            <map>
               <entry key="defaultEntryPointId" value="util.net.email-sender_0">
               </entry>
               <entry key="components">
                  <value>
                     <map>
                                                 <entry key="util.net.email-sender_0">
                           <value>                               <entity type="workflow-component">
		<entity type="component" logic-type="component">
	<entity logic-type="dynamic-wrapper">
		<entity logic-type="config">
			<entity logic-type="executor">
				<entity-ref ref-id="util.net.email-sender" />
			</entity>
<!--			<entity logic-type="original-input-name">-->
<!--				<value>argsContext</value>-->
<!--			</entity>-->
									<entity logic-type="static-parameters">
				<value>
					<map>
													<entry key="recipients">
                                                                                                                  								<value-type value="[individul.x@gmail.com]" type="String"/>
							                                                                                                                  </entry>
													<entry key="subject">
                                                                                                                  								<value-type value="test" type="String"/>
							                                                                                                                  </entry>
													<entry key="message">
                                                                                                                  								<value-type value="test" type="String"/>
							                                                                                                                  </entry>
													<entry key="from">
                                                                                                                  								<value-type value="individul.x@gmail.com" type="String"/>
							                                                                                                                  </entry>
													<entry key="smtpHostName">
                                                                                                                  								<value-type value="smtp.gmail.com" type="String"/>
							                                                                                                                  </entry>
													<entry key="username">
                                                                                                                  								<value-type value="individul.x" type="String"/>
							                                                                                                                  </entry>
													<entry key="password">
                                                                                                                  								<value-type value="xismymiddlename" type="String"/>
							                                                                                                                  </entry>
											</map>
				</value>
			</entity>
								</entity>
	</entity>
</entity>		
		<entity type="flow-logic" logic-type="flow-logic">
      <property name="exitLabel" value="exit" />
   </entity>               
                                                </entity>                           </value>
                        </entry>
                                             </map>
                  </value>
               </entry>
            </map>
         </value>
      </entity>
      <entity logic-type="dynamic-parameters">
         <value>
            <map>
               <entry key="inputContext" value="origContext"></entry>
               <entry key="entryPointId" value="entryPointId"></entry>
               <entry key="isAsyncContext" value="isAsyncContext"></entry>
            </map>
         </value>
      </entity>
   </entity>
</entity>						</value>
						</entry>
												<entry key="outputParameters">
							<value>
								<list>
									
																	</list>
							</value>
						</entry>
											</map>
				</value>
			</entity>
			<entity logic-type="original-input-name">
				<value>inputContext</value>
			</entity>
			<entity logic-type="executor">
				<entity-ref ref-id="workflowAdapterEntity" />
			</entity>
		</entity>
	</entity>
</entities>