<?xml version="1.0" encoding="UTF-8"?>
<!DOCTYPE entities SYSTEM "../../dtds/entities.dtd">
<entities>
   <entity id="ro.problems.flows.get-entity-info-by-id" type="workflow-definition"
      logic-type="dynamic-wrapper">
      <entity type="description">
         <value>$workflowDefinition.getDescription()</value>
      </entity>
      <entity logic-type="config">
         <entity type="definition-params" logic-type="static-parameters">
            <value>
               <map>
                  						<entry key="inputParameters">
							<value>
								<list>
																		<value>
										<entity type="input-parameter">
	<property name="name" value="entityId"></property>
		<property name="type" value="Number"></property>
				<property name="mandatory" value="true"></property>
	                              <property name="uiType" value="TEXTFIELD"/>
               </entity>								</value>
																		<value>
										<entity type="input-parameter">
	<property name="name" value="userId"></property>
		<property name="type" value="Number"></property>
			                              <property name="uiType" value="TEXTFIELD"/>
               </entity>								</value>
																	</list>
							</value>
						</entry>
																		<entry key="localParameters">
							<value>
								<list>
																		<value>
										<entity type="local-parameter">
	<property name="name" value="subtypesList"></property>
		<property name="type" value="List[Context[id=Number,complex_subtype=String,simple_subtype=String]]"></property>
		</entity>								</value>
																		<value>
										<entity type="local-parameter">
	<property name="name" value="result"></property>
		<property name="type" value="List[Context[]]"></property>
		</entity>								</value>
																		<value>
										<entity type="local-parameter">
	<property name="name" value="tags"></property>
		<property name="type" value="List[Context[]]"></property>
		</entity>								</value>
																	</list>
							</value>
						</entry>
												<entry key="executionEntity">
							<value>
																<entity type="workflow" logic-type="dynamic-wrapper">
   <entity logic-type="config">
      <entity logic-type="executor">
         <entity-ref ref-id="workFlow" />
      </entity>
<!--      <entity logic-type="original-input-name">-->
<!--         <value>inputContext</value>-->
<!--      </entity>-->
      <entity type="workflow-params" logic-type="static-parameters">
         <value>
            <map>
               <entry key="defaultEntryPointId" value="ro.problems.data.get-first-level-subtypes-for-entity-id_0">
               </entry>
               <entry key="components">
                  <value>
                     <map>
                                                 <entry key="ro.problems.data.get-first-level-subtypes-for-entity-id_0">
                           <value>                               <entity type="workflow-component">
		<entity type="component" logic-type="component">
	<entity logic-type="dynamic-wrapper">
		<entity logic-type="config">
			<entity logic-type="executor">
				<entity-ref ref-id="ro.problems.data.get-first-level-subtypes-for-entity-id" />
			</entity>
<!--			<entity logic-type="original-input-name">-->
<!--				<value>argsContext</value>-->
<!--			</entity>-->
												<entity logic-type="dynamic-parameters">
				<value>
					<map>
													<entry key="entityId" value="entityId"/>
											</map>
				</value>
			</entity>
					</entity>
	</entity>
</entity>		<entity logic-type="output-params-mappings">
		<value>
			<map>
								<entry key="result" value="subtypesList" />
							</map>
		</value>
	</entity>
		
		<entity type="flow-logic" logic-type="flow-logic">
      <property name="nextComponentId" value="ro.problems.data.get-entity-info-by-id_1" />
   </entity>               
               </entity>                           </value>
                        </entry>
                                                <entry key="ro.problems.data.get-entity-info-by-id_1">
                           <value>                               <entity type="workflow-component">
		<entity type="component" logic-type="component">
	<entity logic-type="dynamic-wrapper">
		<entity logic-type="config">
			<entity logic-type="executor">
				<entity-ref ref-id="ro.problems.data.get-entity-info-by-id" />
			</entity>
<!--			<entity logic-type="original-input-name">-->
<!--				<value>argsContext</value>-->
<!--			</entity>-->
												<entity logic-type="dynamic-parameters">
				<value>
					<map>
													<entry key="entityId" value="entityId"/>
													<entry key="subtypesList" value="subtypesList"/>
													<entry key="userId" value="userId"/>
											</map>
				</value>
			</entity>
					</entity>
	</entity>
</entity>		<entity logic-type="output-params-mappings">
		<value>
			<map>
								<entry key="result" value="result" />
							</map>
		</value>
	</entity>
		
		<entity type="flow-logic" logic-type="flow-logic">
      <property name="nextComponentId" value="ro.problems.data.get-tags-for-entity_2" />
   </entity>               
                                                </entity>                           </value>
                        </entry>
                                                <entry key="ro.problems.data.get-tags-for-entity_2">
                           <value>                               <entity type="workflow-component">
		<entity type="component" logic-type="component">
	<entity logic-type="dynamic-wrapper">
		<entity logic-type="config">
			<entity logic-type="executor">
				<entity-ref ref-id="ro.problems.data.get-tags-for-entity" />
			</entity>
<!--			<entity logic-type="original-input-name">-->
<!--				<value>argsContext</value>-->
<!--			</entity>-->
												<entity logic-type="dynamic-parameters">
				<value>
					<map>
													<entry key="entityId" value="entityId"/>
											</map>
				</value>
			</entity>
					</entity>
	</entity>
</entity>		<entity logic-type="output-params-mappings">
		<value>
			<map>
								<entry key="result" value="tags" />
							</map>
		</value>
	</entity>
		
		<entity type="flow-logic" logic-type="flow-logic">
      <property name="exitLabel" value="exit" />
   </entity>               
                                                </entity>                           </value>
                        </entry>
                                             </map>
                  </value>
               </entry>
            </map>
         </value>
      </entity>
      <entity logic-type="dynamic-parameters">
         <value>
            <map>
               <entry key="inputContext" value="origContext"></entry>
               <entry key="entryPointId" value="entryPointId"></entry>
               <entry key="isAsyncContext" value="isAsyncContext"></entry>
            </map>
         </value>
      </entity>
   </entity>
</entity>						</value>
						</entry>
												<entry key="outputParameters">
							<value>
								<list>
									
																		<value>
										<entity type="output-parameter">
	<property name="name" value="exit"></property>
		<property name="type" value="String"></property>
	</entity>								</value>
																		<value>
										<entity type="output-parameter">
	<property name="name" value="result"></property>
		<property name="type" value="List[Context[]]"></property>
	</entity>								</value>
																		<value>
										<entity type="output-parameter">
	<property name="name" value="tags"></property>
		<property name="type" value="List[Context[]]"></property>
	</entity>								</value>
																	</list>
							</value>
						</entry>
											</map>
				</value>
			</entity>
			<entity logic-type="original-input-name">
				<value>inputContext</value>
			</entity>
			<entity logic-type="executor">
				<entity-ref ref-id="workflowAdapterEntity" />
			</entity>
		</entity>
	</entity>
</entities>