<?xml version="1.0" encoding="UTF-8"?>
<!DOCTYPE entities SYSTEM "../../../dtds/entities.dtd">
<entities>
   <entity id="ro.problems.login" type="data-access-component-definition"
      logic-type="dynamic-wrapper">
      <entity logic-type="config">
         <entity type="definition-params" logic-type="static-parameters">
            <value>
               <map>
                                    <entry key="inputParameters">
                     <value>
                        <list>
                                                      <value>
                              <entity type="input-parameter">
	<property name="name" value="username"></property>
		<property name="type" value="String"></property>
				<property name="mandatory" value="true"></property>
	                              <property name="uiType" value="TEXTFIELD"/>
               </entity>                           </value>
                                                      <value>
                              <entity type="input-parameter">
	<property name="name" value="password"></property>
		<property name="type" value="String"></property>
				<property name="mandatory" value="true"></property>
	                              <property name="uiType" value="TEXTFIELD"/>
               </entity>                           </value>
                                                   </list>
                     </value>
                  </entry>
                                    <entry key="executionEntity">
                     <value>
                        <entity logic-type="dynamic-wrapper">
                           <entity logic-type="config">
                              <entity 
                                 logic-type="static-parameters">
                                 <value>
                                    <map>
                                       <entry key="commandName"
                                          value="ro.problems.login"></entry>
                                       <entry key="commandManager">
                                          <value>
                                             <entity>
                                                <entity-ref
                                                   ref-id="problems_db" />
                                             </entity>
                                          </value>
                                       </entry>
                                    </map>
                                 </value>
                              </entity>
                              <entity logic-type="executor">
                                 <entity-ref ref-id="dataAccessEntity" />
                              </entity>
                              <entity logic-type="original-input-name">
                                 <value>argsContext</value>
                              </entity>
                           </entity>
                        </entity>
                     </value>
                  </entry>
                  <entry key="outputParameters">
                     <value>
                        <list>
                           <value>
                              <entity type="output-parameter">
                                 <property name="name" value="count"></property>
                                 <property name="type" value="Number"></property>
                              </entity>
                           </value>
                           <value>
                              <entity type="output-parameter">
                                 <property name="name" value="result"></property>
                                 <property name="type"
                                    value="List[Context[]]"></property>
                              </entity>
                           </value>
                        </list>
                     </value>
                  </entry>
               </map>
            </value>
         </entity>
         <entity logic-type="original-input-name">
            <value>inputContext</value>
         </entity>
         <entity logic-type="executor">
            <entity-ref ref-id="executionEntityWrapper" />
         </entity>
      </entity>
   </entity>
</entities>