<?xml version="1.0" encoding="UTF-8"?>
<!DOCTYPE entities SYSTEM "../../../../../dtds/entities.dtd">
<entities>
   <entity id="util.net.uri-resolver" type="component-definition"
      logic-type="dynamic-wrapper">
      <entity logic-type="config">
         <entity type="definition-params" logic-type="static-parameters">
            <value>
               <map>
                  <entry key="inputParameters">
                     <value>
                        <list>
                           <value>
                              <entity type="input-parameter">
                                 <property name="name" value="base"></property>
                                 <property name="type" value="String"></property>
                                 <property name="mandatory"
                                    value="true"></property>
                              </entity>
                           </value>
                           <value>
                              <entity type="input-parameter">
                                 <property name="name" value="uri"></property>
                                 <property name="type" value="String"></property>
                                 <property name="mandatory"
                                    value="true"></property>
                              </entity>
                           </value>
                        </list>
                     </value>
                  </entry>
                  <entry key="executionEntity">
                     <value>
                        <entity logic-type="dynamic-wrapper">
                           <entity logic-type="config">
                              <entity logic-type="static-parameters">
                                 <value>
                                    <map>
                                       <entry key="resource">
                                          <value-ref>uriResolver</value-ref>
                                       </entry>
                                       <entry key="method" value="resolve" />
                                       <entry key="argsOrder">
                                          <value>
                                             <list>
                                                <value>uri</value>
                                                <value>base</value>
                                             </list>
                                          </value>
                                       </entry>
                                       <entry key="responseMappingName"
                                          value="url" />
                                    </map>
                                 </value>
                              </entity>
                              <entity logic-type="original-input-name">
                                 <value>argsContext</value>
                              </entity>
                              <entity logic-type="executor">
                                 <entity-ref ref-id="methodCaller" />
                              </entity>
                           </entity>
                        </entity>
                     </value>
                  </entry>
                  <entry key="outputParameters">
                     <value>
                        <list>
                           <value>
                              <entity type="output-parameter">
                                 <property name="name" value="url"></property>
                                 <property name="type" value="String"></property>
                              </entity>
                           </value>
                        </list>
                     </value>
                  </entry>
               </map>
            </value>
         </entity>
         <entity logic-type="original-input-name">
            <value>inputContext</value>
         </entity>
         <entity logic-type="executor">
            <entity-ref ref-id="executionEntityWrapper" />
         </entity>
      </entity>
   </entity>
</entities>